No Time Source Destination Protocol Length Info
    1 0.000000000 142.250.183.234 → 192.168.142.128 SSL 1334 Continuation Data
    2 0.000170185 192.168.142.128 → 142.250.183.234 TCP 54 43248 → 443 [ACK] Seq=1 Ack=1281 Win=65535 Len=0
    3 0.061941428 142.250.183.234 → 192.168.142.128 SSL 3894 Continuation Data
    4 0.062148643 192.168.142.128 → 142.250.183.234 TCP 54 43248 → 443 [ACK] Seq=1 Ack=5121 Win=65535 Len=0
    5 0.107179965 142.250.183.234 → 192.168.142.128 SSL 1334 Continuation Data
    6 0.107330493 192.168.142.128 → 142.250.183.234 TCP 54 43248 → 443 [ACK] Seq=1 Ack=6401 Win=65535 Len=0
    7 0.201342794 142.250.183.234 → 192.168.142.128 SSL 1334 Continuation Data
    8 0.201463474 192.168.142.128 → 142.250.183.234 TCP 54 43248 → 443 [ACK] Seq=1 Ack=7681 Win=65535 Len=0
    9 0.257595414 192.168.142.128 → 192.168.142.2 DNS 75 Standard query 0x24f2 A play.google.com
   10 0.257950031 192.168.142.128 → 192.168.142.2 DNS 75 Standard query 0xb0fb AAAA play.google.com
   11 0.269869471 192.168.142.2 → 192.168.142.128 DNS 91 Standard query response 0x24f2 A play.google.com A 142.250.195.46
   12 0.269870293 192.168.142.2 → 192.168.142.128 DNS 103 Standard query response 0xb0fb AAAA play.google.com AAAA 2404:6800:4007:822::200e
   13 0.276452046 192.168.142.128 → 142.250.195.46 TCP 74 46128 → 443 [SYN] Seq=0 Win=32120 Len=0 MSS=1460 SACK_PERM TSval=3255929576 TSecr=0 WS=128
   14 0.291298974 142.250.183.234 → 192.168.142.128 SSL 1334 Continuation Data
   15 0.291692706 192.168.142.128 → 142.250.183.234 TCP 54 43248 → 443 [ACK] Seq=1 Ack=8961 Win=65535 Len=0
   16 0.297880927 192.168.142.128 → 142.250.195.46 TCP 74 46132 → 443 [SYN] Seq=0 Win=32120 Len=0 MSS=1460 SACK_PERM TSval=3255929597 TSecr=0 WS=128
   17 0.335849468 142.250.195.46 → 192.168.142.128 TCP 60 443 → 46128 [SYN, ACK] Seq=0 Ack=1 Win=64240 Len=0 MSS=1460
   18 0.336024853 192.168.142.128 → 142.250.195.46 TCP 54 46128 → 443 [ACK] Seq=1 Ack=1 Win=32120 Len=0
   19 0.339537798 192.168.142.128 → 142.250.195.46 TLSv1 571 Client Hello (SNI=play.google.com)
   20 0.340088158 142.250.195.46 → 192.168.142.128 TCP 60 443 → 46128 [ACK] Seq=1 Ack=518 Win=64240 Len=0
   21 0.346661745 142.250.195.46 → 192.168.142.128 TCP 60 443 → 46132 [SYN, ACK] Seq=0 Ack=1 Win=64240 Len=0 MSS=1460
   22 0.346818334 192.168.142.128 → 142.250.195.46 TCP 54 46132 → 443 [ACK] Seq=1 Ack=1 Win=32120 Len=0
   23 0.350251237 192.168.142.128 → 142.250.195.46 TLSv1 571 Client Hello (SNI=play.google.com)
   24 0.350890858 142.250.195.46 → 192.168.142.128 TCP 60 443 → 46132 [ACK] Seq=1 Ack=518 Win=64240 Len=0
   25 0.378498512 142.250.183.234 → 192.168.142.128 SSL 1334 Continuation Data
   26 0.378620435 192.168.142.128 → 142.250.183.234 TCP 54 43248 → 443 [ACK] Seq=1 Ack=10241 Win=65535 Len=0
   27 0.406477817 192.168.142.128 → 13.107.42.14 TLSv1.2 161 Application Data
   28 0.406716101 192.168.142.128 → 13.107.42.14 TLSv1.2 883 Application Data
   29 0.407030912 13.107.42.14 → 192.168.142.128 TCP 60 443 → 34242 [ACK] Seq=1 Ack=108 Win=64240 Len=0
   30 0.407031564 13.107.42.14 → 192.168.142.128 TCP 60 443 → 34242 [ACK] Seq=1 Ack=937 Win=64240 Len=0
   31 0.407074435 192.168.142.128 → 13.107.42.14 TLSv1.2 223 Application Data
   32 0.407570472 13.107.42.14 → 192.168.142.128 TCP 60 443 → 34242 [ACK] Seq=1 Ack=1106 Win=64240 Len=0
   33 0.448489695 142.250.183.234 → 192.168.142.128 SSL 1334 Continuation Data
   34 0.448611327 192.168.142.128 → 142.250.183.234 TCP 54 43248 → 443 [ACK] Seq=1 Ack=11521 Win=65535 Len=0
   35 0.542383410 142.250.183.234 → 192.168.142.128 SSL 1334 Continuation Data
   36 0.542526413 192.168.142.128 → 142.250.183.234 TCP 54 43248 → 443 [ACK] Seq=1 Ack=12801 Win=65535 Len=0
   37 0.614063075 142.250.183.234 → 192.168.142.128 SSL 1334 Continuation Data
   38 0.614184657 192.168.142.128 → 142.250.183.234 TCP 54 43248 → 443 [ACK] Seq=1 Ack=14081 Win=65535 Len=0
   39 0.680271037 192.168.142.128 → 142.250.195.46 TCP 74 46136 → 443 [SYN] Seq=0 Win=32120 Len=0 MSS=1460 SACK_PERM TSval=3255929980 TSecr=0 WS=128
   40 0.691817115 142.250.183.234 → 192.168.142.128 SSL 1334 Continuation Data
   41 0.691982080 192.168.142.128 → 142.250.183.234 TCP 54 43248 → 443 [ACK] Seq=1 Ack=15361 Win=65535 Len=0
   42 0.706148951 13.107.42.14 → 192.168.142.128 TLSv1.2 235 Application Data
   43 0.706331920 192.168.142.128 → 13.107.42.14 TCP 54 34242 → 443 [ACK] Seq=1106 Ack=182 Win=30840 Len=0
   44 0.711329118 192.168.142.128 → 142.250.195.46 TCP 74 46148 → 443 [SYN] Seq=0 Win=32120 Len=0 MSS=1460 SACK_PERM TSval=3255930011 TSecr=0 WS=128
   45 0.737963926 142.250.195.46 → 192.168.142.128 TCP 60 443 → 46136 [SYN, ACK] Seq=0 Ack=1 Win=64240 Len=0 MSS=1460
   46 0.738133520 192.168.142.128 → 142.250.195.46 TCP 54 46136 → 443 [ACK] Seq=1 Ack=1 Win=32120 Len=0
   47 0.743121971 192.168.142.128 → 142.250.195.46 TLSv1 571 Client Hello (SNI=play.google.com)
   48 0.744192835 142.250.195.46 → 192.168.142.128 TCP 60 443 → 46136 [ACK] Seq=1 Ack=518 Win=64240 Len=0
   49 0.769488467 142.250.183.234 → 192.168.142.128 SSL 1334 Continuation Data
   50 0.769609919 192.168.142.128 → 142.250.183.234 TCP 54 43248 → 443 [ACK] Seq=1 Ack=16641 Win=65535 Len=0
   51 0.786698656 142.250.195.46 → 192.168.142.128 TCP 60 443 → 46148 [SYN, ACK] Seq=0 Ack=1 Win=64240 Len=0 MSS=1460
   52 0.787267542 192.168.142.128 → 142.250.195.46 TCP 54 46148 → 443 [ACK] Seq=1 Ack=1 Win=32120 Len=0
   53 0.791266866 192.168.142.128 → 142.250.195.46 TLSv1 571 Client Hello (SNI=play.google.com)
   54 0.791916255 142.250.195.46 → 192.168.142.128 TCP 60 443 → 46148 [ACK] Seq=1 Ack=518 Win=64240 Len=0
   55 0.870347768 142.250.195.46 → 192.168.142.128 TLSv1.3 1334 Server Hello, Change Cipher Spec
   56 0.870464811 192.168.142.128 → 142.250.195.46 TCP 54 46132 → 443 [ACK] Seq=518 Ack=1281 Win=30840 Len=0
   57 0.872607581 142.250.195.46 → 192.168.142.128 TLSv1.3 1334 Server Hello, Change Cipher Spec
   58 0.872724865 192.168.142.128 → 142.250.195.46 TCP 54 46128 → 443 [ACK] Seq=518 Ack=1281 Win=30840 Len=0
   59 0.921098776 142.250.195.46 → 192.168.142.128 TCP 1334 443 → 46128 [PSH, ACK] Seq=1281 Ack=518 Win=64240 Len=1280 [TCP segment of a reassembled PDU]
   60 0.921099488 142.250.195.46 → 192.168.142.128 TCP 1334 443 → 46132 [PSH, ACK] Seq=1281 Ack=518 Win=64240 Len=1280 [TCP segment of a reassembled PDU]
   61 0.921221180 192.168.142.128 → 142.250.195.46 TCP 54 46128 → 443 [ACK] Seq=518 Ack=2561 Win=30840 Len=0
   62 0.921289871 192.168.142.128 → 142.250.195.46 TCP 54 46132 → 443 [ACK] Seq=518 Ack=2561 Win=30840 Len=0
   63 1.013406845 142.250.195.67 → 192.168.142.128 SSL 1334 Continuation Data
   64 1.013603871 192.168.142.128 → 142.250.195.67 TCP 54 38066 → 443 [ACK] Seq=1 Ack=1281 Win=65535 Len=0
   65 1.081616427 142.250.195.67 → 192.168.142.128 SSL 7444 Continuation Data
   66 1.081784778 192.168.142.128 → 142.250.195.67 TCP 54 38066 → 443 [ACK] Seq=1 Ack=8671 Win=65535 Len=0
   67 1.175803372 142.250.195.46 → 192.168.142.128 TLSv1.3 1334 Server Hello, Change Cipher Spec
   68 1.175980320 192.168.142.128 → 142.250.195.46 TCP 54 46136 → 443 [ACK] Seq=518 Ack=1281 Win=30840 Len=0
   69 1.222283409 142.250.195.46 → 192.168.142.128 TCP 3894 443 → 46136 [PSH, ACK] Seq=1281 Ack=518 Win=64240 Len=3840 [TCP segment of a reassembled PDU]
   70 1.222407245 192.168.142.128 → 142.250.195.46 TCP 54 46136 → 443 [ACK] Seq=518 Ack=5121 Win=30840 Len=0
   71 1.234692464 142.250.195.46 → 192.168.142.128 TLSv1.3 1334 Server Hello, Change Cipher Spec
   72 1.234824637 192.168.142.128 → 142.250.195.46 TCP 54 46148 → 443 [ACK] Seq=518 Ack=1281 Win=30840 Len=0
   73 1.467679137 142.250.195.46 → 192.168.142.128 TCP 1334 443 → 46132 [PSH, ACK] Seq=2561 Ack=518 Win=64240 Len=1280 [TCP segment of a reassembled PDU]
   74 1.467679969 142.250.195.46 → 192.168.142.128 TCP 1334 443 → 46128 [PSH, ACK] Seq=2561 Ack=518 Win=64240 Len=1280 [TCP segment of a reassembled PDU]
   75 1.467859151 192.168.142.128 → 142.250.195.46 TCP 54 46132 → 443 [ACK] Seq=518 Ack=3841 Win=30840 Len=0
   76 1.467966014 192.168.142.128 → 142.250.195.46 TCP 54 46128 → 443 [ACK] Seq=518 Ack=3841 Win=30840 Len=0
   77 1.508758896 142.250.195.46 → 192.168.142.128 TLSv1.3 2797 Application Data
   78 1.508939391 192.168.142.128 → 142.250.195.46 TCP 54 46132 → 443 [ACK] Seq=518 Ack=6584 Win=30840 Len=0
   79 1.515584064 142.250.195.46 → 192.168.142.128 TLSv1.3 2797 Application Data
   80 1.515648787 192.168.142.128 → 142.250.195.46 TCP 54 46128 → 443 [ACK] Seq=518 Ack=6584 Win=30840 Len=0
   81 1.526431598 192.168.142.128 → 142.250.195.46 TLSv1.3 118 Change Cipher Spec, Application Data
   82 1.527244029 142.250.195.46 → 192.168.142.128 TCP 60 443 → 46132 [ACK] Seq=6584 Ack=582 Win=64240 Len=0
   83 1.528388183 192.168.142.128 → 142.250.195.46 TLSv1.3 224 Application Data
   84 1.528842981 142.250.195.46 → 192.168.142.128 TCP 60 443 → 46132 [ACK] Seq=6584 Ack=752 Win=64240 Len=0
   85 1.532817357 192.168.142.128 → 142.250.195.46 TLSv1.3 118 Change Cipher Spec, Application Data
   86 1.533532492 142.250.195.46 → 192.168.142.128 TCP 60 443 → 46128 [ACK] Seq=6584 Ack=582 Win=64240 Len=0
   87 1.534168145 192.168.142.128 → 142.250.195.46 TLSv1.3 241 Application Data
   88 1.534598857 142.250.195.46 → 192.168.142.128 TCP 60 443 → 46128 [ACK] Seq=6584 Ack=769 Win=64240 Len=0
   89 1.536775191 192.168.142.128 → 142.250.195.46 TLSv1.3 397 Application Data
   90 1.537271599 142.250.195.46 → 192.168.142.128 TCP 60 443 → 46132 [ACK] Seq=6584 Ack=1095 Win=64240 Len=0
   91 1.572659975 142.250.195.46 → 192.168.142.128 TLSv1.3 668 Application Data, Application Data
   92 1.574501209 192.168.142.128 → 142.250.195.46 TLSv1.3 85 Application Data
   93 1.575255078 142.250.195.46 → 192.168.142.128 TCP 60 443 → 46132 [ACK] Seq=7198 Ack=1126 Win=64240 Len=0
   94 1.583053423 142.250.195.46 → 192.168.142.128 TLSv1.3 668 Application Data, Application Data
   95 1.585865250 192.168.142.128 → 142.250.195.46 TLSv1.3 78 Application Data
   96 1.586182966 142.250.195.46 → 192.168.142.128 TCP 60 443 → 46128 [ACK] Seq=7198 Ack=793 Win=64240 Len=0
   97 1.586414749 192.168.142.128 → 142.250.195.46 TCP 54 46128 → 443 [FIN, ACK] Seq=793 Ack=7198 Win=30840 Len=0
   98 1.587097552 142.250.195.46 → 192.168.142.128 TCP 60 443 → 46128 [ACK] Seq=7198 Ack=794 Win=64239 Len=0
   99 1.627698607 142.250.195.46 → 192.168.142.128 TLSv1.3 85 Application Data
  100 1.627774121 192.168.142.128 → 142.250.195.46 TCP 54 46128 → 443 [RST] Seq=794 Win=0 Len=0
  101 1.630545661 142.250.195.46 → 192.168.142.128 TLSv1.3 85 Application Data
  102 1.675801862 192.168.142.128 → 142.250.195.46 TCP 54 46132 → 443 [ACK] Seq=1126 Ack=7229 Win=30840 Len=0
  103 1.712819678 142.250.195.46 → 192.168.142.128 TLSv1.3 469 Application Data, Application Data, Application Data
  104 1.712902005 192.168.142.128 → 142.250.195.46 TCP 54 46132 → 443 [ACK] Seq=1126 Ack=7644 Win=30840 Len=0
  105 1.715723421 192.168.142.128 → 142.250.195.46 TLSv1.3 93 Application Data
  106 1.716632886 142.250.195.46 → 192.168.142.128 TCP 60 443 → 46132 [ACK] Seq=7644 Ack=1165 Win=64240 Len=0
  107 1.722175646 192.168.142.128 → 142.250.195.46 TLSv1.3 186 Application Data
  108 1.722442956 192.168.142.128 → 142.250.195.46 TLSv1.3 542 Application Data
  109 1.722648659 142.250.195.46 → 192.168.142.128 TCP 60 443 → 46132 [ACK] Seq=7644 Ack=1297 Win=64240 Len=0
  110 1.722847218 142.250.195.46 → 192.168.142.128 TCP 60 443 → 46132 [ACK] Seq=7644 Ack=1785 Win=64240 Len=0
  111 1.722872997 192.168.142.128 → 142.250.195.46 QUIC 1399 0-RTT, DCID=5564d39776115798, SCID=f7e21c
  112 1.772408646 142.250.195.46 → 192.168.142.128 TCP 1334 443 → 46136 [PSH, ACK] Seq=5121 Ack=518 Win=64240 Len=1280 [TCP segment of a reassembled PDU]
  113 1.772473630 192.168.142.128 → 142.250.195.46 TCP 54 46136 → 443 [ACK] Seq=518 Ack=6401 Win=30840 Len=0
  114 1.813356193 142.250.195.46 → 192.168.142.128 TCP 1334 443 → 46148 [PSH, ACK] Seq=1281 Ack=518 Win=64240 Len=1280 [TCP segment of a reassembled PDU]
  115 1.813356894 142.250.195.46 → 192.168.142.128 QUIC 1399 Initial, DCID=f7e21c, SCID=f564d39776115798, PKN: 1, ACK, PADDING
  116 1.813434282 192.168.142.128 → 142.250.195.46 TCP 54 46148 → 443 [ACK] Seq=518 Ack=2561 Win=30840 Len=0
  117 1.816257220 142.250.195.46 → 192.168.142.128 QUIC 1399 Handshake, DCID=f7e21c, SCID=f564d39776115798
  118 1.816257961 142.250.195.46 → 192.168.142.128 QUIC 657 Protected Payload (KP0), DCID=f7e21c
  119 1.816258162 142.250.195.46 → 192.168.142.128 QUIC 69 Protected Payload (KP0), DCID=f7e21c
  120 1.818945892 192.168.142.128 → 142.250.195.46 QUIC 155 Protected Payload (KP0), DCID=f564d39776115798
  121 1.861900940 142.250.195.46 → 192.168.142.128 TLSv1.3 238 Application Data
  122 1.861983538 192.168.142.128 → 142.250.195.46 TCP 54 46136 → 443 [ACK] Seq=518 Ack=6585 Win=30840 Len=0
  123 1.873165691 192.168.142.128 → 142.250.195.46 TLSv1.3 118 Change Cipher Spec, Application Data
  124 1.873758653 142.250.195.46 → 192.168.142.128 TCP 60 443 → 46136 [ACK] Seq=6585 Ack=582 Win=64240 Len=0
  125 1.874313642 192.168.142.128 → 142.250.195.46 TLSv1.3 241 Application Data
  126 1.874811573 142.250.195.46 → 192.168.142.128 TCP 60 443 → 46136 [ACK] Seq=6585 Ack=769 Win=64240 Len=0
  127 1.875966688 142.250.195.46 → 192.168.142.128 QUIC 165 Protected Payload (KP0), DCID=f7e21c
  128 1.876689768 192.168.142.128 → 142.250.195.46 TLSv1.3 148 Application Data
  129 1.877272249 142.250.195.46 → 192.168.142.128 TCP 60 443 → 46132 [ACK] Seq=7644 Ack=1879 Win=64240 Len=0
  130 1.897919279 192.168.142.128 → 142.250.195.46 QUIC 74 Protected Payload (KP0), DCID=f564d39776115798
  131 1.912679542 142.250.195.46 → 192.168.142.128 TLSv1.3 822 Application Data, Application Data
  132 1.914720788 142.250.195.46 → 192.168.142.128 TLSv1.3 124 Application Data, Application Data
  133 1.915320833 192.168.142.128 → 142.250.195.46 TCP 54 46132 → 443 [ACK] Seq=1879 Ack=8482 Win=30840 Len=0
  134 1.915874951 192.168.142.128 → 142.250.195.46 TLSv1.3 93 Application Data
  135 1.916553847 142.250.195.46 → 192.168.142.128 TCP 60 443 → 46132 [ACK] Seq=8482 Ack=1918 Win=64240 Len=0
  136 1.918683401 142.250.195.46 → 192.168.142.128 TLSv1.3 668 Application Data, Application Data
  137 1.921444662 192.168.142.128 → 142.250.195.46 TLSv1.3 78 Application Data
  138 1.921776395 142.250.195.46 → 192.168.142.128 TCP 60 443 → 46136 [ACK] Seq=7199 Ack=793 Win=64240 Len=0
  139 1.922059265 192.168.142.128 → 142.250.195.46 TCP 54 46136 → 443 [FIN, ACK] Seq=793 Ack=7199 Win=30840 Len=0
  140 1.922768839 142.250.195.46 → 192.168.142.128 TCP 60 443 → 46136 [ACK] Seq=7199 Ack=794 Win=64239 Len=0
  141 1.972367038 142.250.195.46 → 192.168.142.128 TLSv1.3 85 Application Data
  142 1.972421181 192.168.142.128 → 142.250.195.46 TCP 54 46136 → 443 [RST] Seq=794 Win=0 Len=0
  143 1.972641932 142.250.195.46 → 192.168.142.128 TCP 60 443 → 46136 [FIN, PSH, ACK] Seq=7230 Ack=794 Win=64239 Len=0
  144 1.972659646 192.168.142.128 → 142.250.195.46 TCP 54 46136 → 443 [RST] Seq=794 Win=0 Len=0
  145 2.001138384 192.168.142.128 → 142.250.183.234 TLSv1.2 89 Application Data
  146 2.001477050 192.168.142.128 → 142.250.183.234 TLSv1.2 93 Application Data
  147 2.001730935 142.250.183.234 → 192.168.142.128 TCP 60 443 → 43248 [ACK] Seq=16641 Ack=36 Win=64240 Len=0
  148 2.001731566 142.250.183.234 → 192.168.142.128 TCP 60 443 → 43248 [ACK] Seq=16641 Ack=75 Win=64240 Len=0
  149 2.002268611 192.168.142.128 → 142.250.183.234 TLSv1.2 78 Application Data
  150 2.002605734 142.250.183.234 → 192.168.142.128 TCP 60 443 → 43248 [ACK] Seq=16641 Ack=99 Win=64240 Len=0
  151 2.002807500 192.168.142.128 → 142.250.183.234 TCP 54 43248 → 443 [FIN, ACK] Seq=99 Ack=16641 Win=65535 Len=0
  152 2.003678061 142.250.183.234 → 192.168.142.128 TCP 60 443 → 43248 [ACK] Seq=16641 Ack=100 Win=64239 Len=0
  153 2.021939006 142.250.195.46 → 192.168.142.128 TLSv1.3 122 Application Data
  154 2.022750685 142.250.195.46 → 192.168.142.128 TLSv1.3 124 Application Data, Application Data
  155 2.022976245 192.168.142.128 → 142.250.195.46 TCP 54 46132 → 443 [ACK] Seq=1918 Ack=8620 Win=30840 Len=0
  156 2.023203139 192.168.142.128 → 142.250.195.46 TLSv1.3 93 Application Data
  157 2.024111162 142.250.195.46 → 192.168.142.128 TCP 60 443 → 46132 [ACK] Seq=8620 Ack=1957 Win=64240 Len=0
  158 2.025464475 192.168.142.128 → 142.250.195.46 TLSv1.3 152 Application Data
  159 2.026071153 142.250.195.46 → 192.168.142.128 TCP 60 443 → 46132 [ACK] Seq=8620 Ack=2055 Win=64240 Len=0
  160 2.026308997 192.168.142.128 → 142.250.195.46 TLSv1.3 506 Application Data
  161 2.026584553 142.250.195.46 → 192.168.142.128 TCP 60 443 → 46132 [ACK] Seq=8620 Ack=2507 Win=64240 Len=0
  162 2.203895667 192.168.142.128 → 142.250.183.195 TCP 54 41946 → 80 [ACK] Seq=1 Ack=1 Win=31545 Len=0
  163 2.204340446 142.250.183.195 → 192.168.142.128 TCP 60 [TCP ACKed unseen segment] 80 → 41946 [ACK] Seq=1 Ack=2 Win=64240 Len=0
  164 2.209893175 142.250.195.46 → 192.168.142.128 TLSv1.3 555 Application Data, Application Data
  165 2.211347390 142.250.195.46 → 192.168.142.128 TLSv1.3 124 Application Data, Application Data
  166 2.212086226 192.168.142.128 → 142.250.195.46 TCP 54 46132 → 443 [ACK] Seq=2507 Ack=9191 Win=30840 Len=0
  167 2.212306096 192.168.142.128 → 142.250.195.46 TLSv1.3 93 Application Data
  168 2.212961181 142.250.195.46 → 192.168.142.128 TCP 60 443 → 46132 [ACK] Seq=9191 Ack=2546 Win=64240 Len=0
  169 2.399912416 192.168.142.128 → 13.107.42.14 TLSv1.2 162 Application Data
  170 2.400128719 192.168.142.128 → 13.107.42.14 TLSv1.2 883 Application Data
  171 2.400616269 13.107.42.14 → 192.168.142.128 TCP 60 443 → 34242 [ACK] Seq=182 Ack=1214 Win=64240 Len=0
  172 2.400741799 192.168.142.128 → 13.107.42.14 TLSv1.2 219 Application Data
  173 2.401063613 13.107.42.14 → 192.168.142.128 TCP 60 443 → 34242 [ACK] Seq=182 Ack=2043 Win=64240 Len=0
  174 2.401064114 13.107.42.14 → 192.168.142.128 TCP 60 443 → 34242 [ACK] Seq=182 Ack=2208 Win=64240 Len=0
  175 2.408286630 142.250.183.234 → 192.168.142.128 TLSv1.2 1334 Ignored Unknown Record
  176 2.408349199 192.168.142.128 → 142.250.183.234 TCP 54 43248 → 443 [RST] Seq=100 Win=0 Len=0
  177 2.708753252 13.107.42.14 → 192.168.142.128 TLSv1.2 234 Application Data
  178 2.708913618 192.168.142.128 → 13.107.42.14 TCP 54 34242 → 443 [ACK] Seq=2208 Ack=362 Win=30840 Len=0
  179 2.889114208 142.250.195.46 → 192.168.142.128 TCP 1334 443 → 46148 [PSH, ACK] Seq=2561 Ack=518 Win=64240 Len=1280 [TCP segment of a reassembled PDU]
  180 2.889293360 192.168.142.128 → 142.250.195.46 TCP 54 46148 → 443 [ACK] Seq=518 Ack=3841 Win=30840 Len=0
  181 2.968154883 142.250.195.46 → 192.168.142.128 TLSv1.3 2797 Application Data
  182 2.968312234 192.168.142.128 → 142.250.195.46 TCP 54 46148 → 443 [ACK] Seq=518 Ack=6584 Win=30840 Len=0
  183 2.985974816 192.168.142.128 → 142.250.195.46 TLSv1.3 118 Change Cipher Spec, Application Data
  184 2.986841821 142.250.195.46 → 192.168.142.128 TCP 60 443 → 46148 [ACK] Seq=6584 Ack=582 Win=64240 Len=0
  185 2.988205995 192.168.142.128 → 142.250.195.46 TLSv1.3 241 Application Data
  186 2.989493142 142.250.195.46 → 192.168.142.128 TCP 60 443 → 46148 [ACK] Seq=6584 Ack=769 Win=64240 Len=0
  187 3.041216376 142.250.195.46 → 192.168.142.128 TLSv1.3 668 Application Data, Application Data
  188 3.043005962 192.168.142.128 → 142.250.195.46 TLSv1.3 78 Application Data
  189 3.043200062 192.168.142.128 → 142.250.195.46 TCP 54 46148 → 443 [FIN, ACK] Seq=793 Ack=7198 Win=30840 Len=0
  190 3.043615535 142.250.195.46 → 192.168.142.128 TCP 60 443 → 46148 [ACK] Seq=7198 Ack=793 Win=64240 Len=0
  191 3.043844973 142.250.195.46 → 192.168.142.128 TCP 60 443 → 46148 [ACK] Seq=7198 Ack=794 Win=64239 Len=0
  192 3.091636062 142.250.195.46 → 192.168.142.128 TLSv1.3 85 Application Data
  193 3.091693362 192.168.142.128 → 142.250.195.46 TCP 54 46148 → 443 [RST] Seq=794 Win=0 Len=0
